{
  "version": 1,
  "settings": {
    "title": "Home",
    "theme": "android",
    "fx": "auto",
    "search": "duckduckgo"
  },
  "groups": [
    {
      "id": "media",
      "name": "Media",
      "order": 1
    }
  ],
  "services": [
    {
      "id": "media-server",
      "name": "Media Server",
      "group": "media",
      "icon": "media",
      "urls": {
        "lan": "http://192.168.1.10:8096",
        "tailscale": "http://server.example.ts.net:8096",
        "public": "https://media.example.com"
      },
      "check": {
        "type": "http",
        "expect": 200,
        "interval": 60
      }
    }
  ],
  "overrides": {
    "docker:media/media-server": {
      "name": "Movies",
      "pinned": true
    }
  },
  "layout": {
    "type": "grid",
    "columns": "auto",
    "profiles": {
      "home": []
    }
  },
  "widgets": [],
  "engines": [
    {
      "id": "duckduckgo",
      "prefix": "d",
      "url": "https://duckduckgo.com/?q=%s"
    }
  ]
}
